{
  "slug": "jellybean-boom",
  "title": "The Jellybean Boom",
  "sources": [],
  "cast": [
    {
      "characterId": "_placeholder",
      "role": "narrator"
    }
  ],
  "beats": [
    { "id": "b_jar", "summary": "A jellybean escapes a jar.", "sceneRef": "jar" },
    { "id": "b_mayor", "summary": "It declares itself mayor.", "sceneRef": "mayor" },
    { "id": "b_cup", "summary": "It gets stuck in a teacup and learns to share.", "sceneRef": "cup" }
  ],
  "variants": [],
  "language": "en"
}
