{
  "slug": "smoke",
  "title": "Smoke",
  "sources": [],
  "cast": [
    {
      "characterId": "_placeholder",
      "role": "narrator"
    }
  ],
  "beats": [
    {
      "id": "b_opening",
      "summary": "The placeholder takes the stage.",
      "sceneRef": "opening"
    },
    {
      "id": "b_greeting",
      "summary": "It greets the world.",
      "sceneRef": "greeting"
    }
  ],
  "variants": [],
  "language": "en"
}
